{
  "metadata": {
    "object_type": "doctrine_mesh_independent_specification_review",
    "trust_zone": "proposed",
    "lifecycle_status": "independently_checked",
    "provenance_note": "Recorded on 2026-08-24 by Codex root from task-separated read-only reviews and changed-input confirmations; final payload bindings include independent byte-semantic review of the staged EOF-whitespace and checkout-newline portability repairs.",
    "reason_for_inclusion": "Bind the exact frozen payload to the final independent artifact-freeze verdict while retaining all runtime and human-authority limits."
  },
  "schema_version": "logos.doctrine_mesh_independent_specification_review.v2",
  "review_id": "DM-INDEPENDENT-REVIEW-002",
  "revision_manifest_ref": "revision-manifest.yaml",
  "revision_manifest_digest": "sha256:d06f896d9ea473ed6a37d89857d753df182d31205eda777909f2436ae83a00a3",
  "payload_digest": "sha256:00143bcff73658b6051f8ff34dffd27ebbb72730893e4478246c1c23009a5bdf",
  "review_lineage_ref": "evidence/independence/review-lineage.yaml",
  "review_lineage_digest": "sha256:6826ba13103cb50075ca129c93b48ac9d1a454a96cbab282809f9e95d87cdf3c",
  "reviewer_lanes": [
    "autonomy_authority_redteam",
    "campaign_integration_checker",
    "deterministic_schema_checker",
    "release_evidence_checker",
    "release_authority_redteam"
  ],
  "independence_status": "partly_verified_non_authorizing",
  "cross_provider_verified": false,
  "status": "pass_specification_only",
  "finding_counts": {"critical": 0, "high": 0, "medium": 0, "low": 0},
  "unresolved_runtime_boundaries": [
    "actual_source_researched_and_rights_cleared_ExpertPacks",
    "authenticated_human_authority",
    "cross_provider_independence",
    "qualified_controller_and_semantic_runtime_fixtures",
    "qualified_domain_humans",
    "substantive_doctrine_research_and_decisions"
  ],
  "runtime_activation_authorized": false,
  "research_authorized": false,
  "source_ingestion_authorized": false,
  "doctrine_decision_authorized": false,
  "cross_repository_write_authorized": false,
  "publication_authorized": false,
  "observed_at": "2026-08-24T19:31:11Z",
  "review_digest": "sha256:93589f975f27ad88383974b238df55962f0627ada36248ad5f218691d98925c8"
}
